{
  "finding_id": "f_0021",
  "scan_id": "scan_7f3a",
  "subject": { "kind": "part", "ref": "BRKT1" },
  "state": "missing",
  "source": "grain.diagnose",
  "confidence": 0.3,
  "is_proof": false,
  "evidence": ["Grain diagnose: BRKT1 not seen (coverage 5%) on a side the scan swept"],
  "measurements": { "coverage": 0.05 },
  "grain": {
    "endpoint": "diagnose",
    "verdict": "not_seen",
    "name": "BRKT1",
    "ref": null,
    "raw": { "name": "BRKT1", "ref": null, "verdict": "not_seen", "coverage": 0.05, "visible_share": 0.61, "tolerance_used_mm": 2.25 }
  },
  "design_trust": "low",
  "on_symptom_power_path": false,
  "created_at": "2026-10-23T18:11:02Z"
}
